category,note
01 Geocoded Location Data,"Home, workplace and school locations were not surveyed"
01 Geocoded Location Data,"Trip origin was not surveyed"
01 Geocoded Location DAta,"First transit boarding and last transit alighting locations were not surveyed"
03 Transit Transfers,Transfer infomation was not surveyed
04 Origin and Destination Trip Purposes,Trip purpose was surveyed rather than origin or destination purpose
05 Time Leaving and Returning Home,Time leaving and returning home were not surveyed
07 Half Tour Questions for Work and School,Half-tour information was not surveyed
